[
  {
    "id": "opt_lip_fillers_stylage_m",
    "serviceId": "svc_lip_fillers",
    "nameKey": "opt.lip_fillers.stylage_m",
    "price": { "amount": 330, "currency": "USD" },
    "isOptionPromoActive": true,
    "promoPrice": { "amount": 290, "currency": "USD" },
    "priceTextKey": "",
    "notesKeys": [
      "note.lip_fillers.stylage_premium_lab",
      "note.lip_fillers.stylage_tech",
      "note.lip_fillers.stylage_zones",
      "note.lip_fillers.stylage_syringe",
      "note.lip_fillers.stylage_lidocaine",
      "note.lip_fillers.stylage_duration"
    ]
  },
  {
    "id": "opt_lip_fillers_volift",
    "serviceId": "svc_lip_fillers",
    "nameKey": "opt.lip_fillers.volift",
    "price": { "amount": 385, "currency": "USD" },
    "isOptionPromoActive": true,
    "promoPrice": { "amount": 350, "currency": "USD" },
    "priceTextKey": "",
    "notesKeys": [
      "note.lip_fillers.volift_premium_lab",
      "note.lip_fillers.volift_tech",
      "note.lip_fillers.volift_zones",
      "note.lip_fillers.volift_syringe",
      "note.lip_fillers.volift_lidocaine",
      "note.lip_fillers.volift_duration"
    ]
  },
  {
    "id": "opt_lip_fillers_volbella",
    "serviceId": "svc_lip_fillers",
    "nameKey": "opt.lip_fillers.volbella",
    "price": { "amount": 385, "currency": "USD" },
    "isOptionPromoActive": false,
    "promoPrice": null,
    "priceTextKey": "",
    "notesKeys": [
      "note.lip_fillers.volbella_premium_lab",
      "note.lip_fillers.volbella_tech",
      "note.lip_fillers.volbella_zones",
      "note.lip_fillers.volbella_syringe",
      "note.lip_fillers.volbella_lidocaine",
      "note.lip_fillers.volbella_duration"
    ]
  },
  {
    "id": "opt_lip_fillers_generic_deep",
    "serviceId": "svc_lip_fillers",
    "nameKey": "opt.lip_fillers.generic_deep",
    "price": { "amount": 300, "currency": "USD" },
    "isOptionPromoActive": false,
    "promoPrice": null,
    "priceTextKey": "",
    "notesKeys": [
      "note.lip_fillers.generic_deep_premium_lab",
      "note.lip_fillers.generic_deep_composition",
      "note.lip_fillers.generic_deep_depth",
      "note.lip_fillers.generic_deep_lidocaine",
      "note.lip_fillers.generic_deep_duration"
    ]
  },
  {
    "id": "opt_facial_balancing_volift",
    "serviceId": "svc_facial_balancing",
    "nameKey": "opt.facial_balancing.volift",
    "price": { "amount": 385, "currency": "USD" },
    "isOptionPromoActive": true,
    "promoPrice": { "amount": 350, "currency": "USD" },
    "priceTextKey": "",
    "notesKeys": [
      "note.facial_balancing.volift_tech",
      "note.facial_balancing.volift_purpose",
      "note.facial_balancing.volift_zones",
      "note.facial_balancing.volift_lidocaine",
      "note.facial_balancing.volift_duration",
      "note.promo.facial_balancing.supply_note"
    ]
  },
  {
    "id": "opt_facial_balancing_voluma",
    "serviceId": "svc_facial_balancing",
    "nameKey": "opt.facial_balancing.voluma",
    "price": { "amount": 390, "currency": "USD" },
    "isOptionPromoActive": false,
    "promoPrice": null,
    "priceTextKey": "",
    "notesKeys": [
      "note.facial_balancing.voluma_tech",
      "note.facial_balancing.voluma_purpose",
      "note.facial_balancing.voluma_zones",
      "note.facial_balancing.voluma_lidocaine",
      "note.facial_balancing.voluma_duration",
      "note.promo.facial_balancing.supply_note"
    ]
  },
  {
    "id": "opt_facial_balancing_volux",
    "serviceId": "svc_facial_balancing",
    "nameKey": "opt.facial_balancing.volux",
    "price": { "amount": 390, "currency": "USD" },
    "isOptionPromoActive": false,
    "promoPrice": null,
    "priceTextKey": "",
    "notesKeys": [
      "note.facial_balancing.volux_tech",
      "note.facial_balancing.volux_purpose",
      "note.facial_balancing.volux_zones",
      "note.facial_balancing.volux_lidocaine",
      "note.facial_balancing.volux_duration",
      "note.promo.facial_balancing.supply_note"
    ]
  },
  {
    "id": "opt_hyaluronidase_vial",
    "serviceId": "svc_hyaluronidase",
    "nameKey": "opt.hyaluronidase.vial",
    "price": { "amount": 60, "currency": "USD" },
    "isOptionPromoActive": false,
    "promoPrice": null,
    "priceTextKey": "",
    "notesKeys": [
      "note.hyaluronidase.price_per_vial"
    ]
  }
]
