[
  {
    "id": "opt_hydrafacial_face",
    "serviceId": "svc_hydrafacial",
    "nameKey": "opt.hydrafacial.face",
    "price": { "amount": 95, "currency": "USD" },
    "isOptionPromoActive": false,
    "promoPrice": null,
    "priceTextKey": "",
    "filterGroupKey": "face",
    "notesKeys": []
  },
  {
    "id": "opt_hydrafacial_upper_back",
    "serviceId": "svc_hydrafacial",
    "nameKey": "opt.hydrafacial.upper_back",
    "price": { "amount": 150, "currency": "USD" },
    "isOptionPromoActive": false,
    "promoPrice": null,
    "priceTextKey": "",
    "filterGroupKey": "body",
    "notesKeys": []
  },
  {
    "id": "opt_casmara_infinity",
    "serviceId": "svc_casmara_infinity",
    "nameKey": "opt.casmara_infinity",
    "price": { "amount": 95, "currency": "USD" },
    "isOptionPromoActive": false,
    "promoPrice": null,
    "priceTextKey": "",
    "filterGroupKey": "face",
    "notesKeys": []
  },
  {
    "id": "opt_casmara_purifying",
    "serviceId": "svc_casmara_purifying",
    "nameKey": "opt.casmara_purifying",
    "price": { "amount": 85, "currency": "USD" },
    "isOptionPromoActive": false,
    "promoPrice": null,
    "priceTextKey": "",
    "filterGroupKey": "face",
    "notesKeys": []
  },
  {
    "id": "opt_casmara_retinol_proage",
    "serviceId": "svc_casmara_retinol_proage",
    "nameKey": "opt.casmara_retinol_proage",
    "price": { "amount": 90, "currency": "USD" },
    "isOptionPromoActive": false,
    "promoPrice": null,
    "priceTextKey": "",
    "filterGroupKey": "face",
    "notesKeys": []
  },
  {
    "id": "opt_janssen_radiance_face",
    "serviceId": "svc_janssen_radiance_boost",
    "nameKey": "opt.janssen_radiance.face",
    "price": { "amount": 45, "currency": "USD" },
    "isOptionPromoActive": false,
    "promoPrice": null,
    "priceTextKey": "",
    "filterGroupKey": "face",
    "notesKeys": []
  },
  {
    "id": "opt_janssen_ultra_face",
    "serviceId": "svc_janssen_ultra_renewal",
    "nameKey": "opt.janssen_ultra.face",
    "price": { "amount": 55, "currency": "USD" },
    "isOptionPromoActive": false,
    "promoPrice": null,
    "priceTextKey": "",
    "filterGroupKey": "face",
    "notesKeys": []
  },
  {
    "id": "opt_hydrafacial_shoulders",
    "serviceId": "svc_hydrafacial",
    "nameKey": "opt.hydrafacial.shoulders",
    "price": { "amount": 130, "currency": "USD" },
    "isOptionPromoActive": false,
    "promoPrice": null,
    "priceTextKey": "",
    "filterGroupKey": "body",
    "notesKeys": []
  },
  {
    "id": "opt_janssen_ultra_face_neck",
    "serviceId": "svc_janssen_ultra_renewal",
    "nameKey": "opt.janssen_ultra.face_neck",
    "price": { "amount": 65, "currency": "USD" },
    "isOptionPromoActive": false,
    "promoPrice": null,
    "priceTextKey": "",
    "filterGroupKey": "face",
    "notesKeys": []
  },
  {
    "id": "opt_janssen_ultra_face_neck_decollete",
    "serviceId": "svc_janssen_ultra_renewal",
    "nameKey": "opt.janssen_ultra.face_neck_decollete",
    "price": { "amount": 70, "currency": "USD" },
    "isOptionPromoActive": false,
    "promoPrice": null,
    "priceTextKey": "",
    "filterGroupKey": "face",
    "notesKeys": []
  },
  {
    "id": "opt_janssen_radiance_face_neck",
    "serviceId": "svc_janssen_radiance_boost",
    "nameKey": "opt.janssen_radiance.face_neck",
    "price": { "amount": 50, "currency": "USD" },
    "isOptionPromoActive": false,
    "promoPrice": null,
    "priceTextKey": "",
    "filterGroupKey": "face",
    "notesKeys": []
  },
  {
    "id": "opt_janssen_radiance_face_neck_decollete",
    "serviceId": "svc_janssen_radiance_boost",
    "nameKey": "opt.janssen_radiance.face_neck_decollete",
    "price": { "amount": 55, "currency": "USD" },
    "isOptionPromoActive": false,
    "promoPrice": null,
    "priceTextKey": "",
    "filterGroupKey": "face",
    "notesKeys": []
  },
  {
    "id": "opt_hydrafacial_booster_melafadin",
    "serviceId": "svc_hydrafacial",
    "nameKey": "opt.facial_booster.melafadin",
    "price": { "amount": 5, "currency": "USD" },
    "isOptionPromoActive": false,
    "promoPrice": null,
    "priceTextKey": "",
    "filterGroupKey": "boosters",
    "notesKeys": []
  },
  {
    "id": "opt_hydrafacial_booster_contour_fluid",
    "serviceId": "svc_hydrafacial",
    "nameKey": "opt.facial_booster.contour_fluid",
    "price": { "amount": 5, "currency": "USD" },
    "isOptionPromoActive": false,
    "promoPrice": null,
    "priceTextKey": "",
    "filterGroupKey": "boosters",
    "notesKeys": []
  },
  {
    "id": "opt_hydrafacial_booster_caviar",
    "serviceId": "svc_hydrafacial",
    "nameKey": "opt.facial_booster.caviar",
    "price": { "amount": 5, "currency": "USD" },
    "isOptionPromoActive": false,
    "promoPrice": null,
    "priceTextKey": "",
    "filterGroupKey": "boosters",
    "notesKeys": []
  },
  {
    "id": "opt_casmara_infinity_booster_melafadin",
    "serviceId": "svc_casmara_infinity",
    "nameKey": "opt.facial_booster.melafadin",
    "price": { "amount": 5, "currency": "USD" },
    "isOptionPromoActive": false,
    "promoPrice": null,
    "priceTextKey": "",
    "filterGroupKey": "boosters",
    "notesKeys": []
  },
  {
    "id": "opt_casmara_infinity_booster_contour_fluid",
    "serviceId": "svc_casmara_infinity",
    "nameKey": "opt.facial_booster.contour_fluid",
    "price": { "amount": 5, "currency": "USD" },
    "isOptionPromoActive": false,
    "promoPrice": null,
    "priceTextKey": "",
    "filterGroupKey": "boosters",
    "notesKeys": []
  },
  {
    "id": "opt_casmara_infinity_booster_caviar",
    "serviceId": "svc_casmara_infinity",
    "nameKey": "opt.facial_booster.caviar",
    "price": { "amount": 5, "currency": "USD" },
    "isOptionPromoActive": false,
    "promoPrice": null,
    "priceTextKey": "",
    "filterGroupKey": "boosters",
    "notesKeys": []
  },
  {
    "id": "opt_casmara_purifying_booster_melafadin",
    "serviceId": "svc_casmara_purifying",
    "nameKey": "opt.facial_booster.melafadin",
    "price": { "amount": 5, "currency": "USD" },
    "isOptionPromoActive": false,
    "promoPrice": null,
    "priceTextKey": "",
    "filterGroupKey": "boosters",
    "notesKeys": []
  },
  {
    "id": "opt_casmara_purifying_booster_contour_fluid",
    "serviceId": "svc_casmara_purifying",
    "nameKey": "opt.facial_booster.contour_fluid",
    "price": { "amount": 5, "currency": "USD" },
    "isOptionPromoActive": false,
    "promoPrice": null,
    "priceTextKey": "",
    "filterGroupKey": "boosters",
    "notesKeys": []
  },
  {
    "id": "opt_casmara_purifying_booster_caviar",
    "serviceId": "svc_casmara_purifying",
    "nameKey": "opt.facial_booster.caviar",
    "price": { "amount": 5, "currency": "USD" },
    "isOptionPromoActive": false,
    "promoPrice": null,
    "priceTextKey": "",
    "filterGroupKey": "boosters",
    "notesKeys": []
  },
  {
    "id": "opt_casmara_retinol_booster_melafadin",
    "serviceId": "svc_casmara_retinol_proage",
    "nameKey": "opt.facial_booster.melafadin",
    "price": { "amount": 5, "currency": "USD" },
    "isOptionPromoActive": false,
    "promoPrice": null,
    "priceTextKey": "",
    "filterGroupKey": "boosters",
    "notesKeys": []
  },
  {
    "id": "opt_casmara_retinol_booster_contour_fluid",
    "serviceId": "svc_casmara_retinol_proage",
    "nameKey": "opt.facial_booster.contour_fluid",
    "price": { "amount": 5, "currency": "USD" },
    "isOptionPromoActive": false,
    "promoPrice": null,
    "priceTextKey": "",
    "filterGroupKey": "boosters",
    "notesKeys": []
  },
  {
    "id": "opt_casmara_retinol_booster_caviar",
    "serviceId": "svc_casmara_retinol_proage",
    "nameKey": "opt.facial_booster.caviar",
    "price": { "amount": 5, "currency": "USD" },
    "isOptionPromoActive": false,
    "promoPrice": null,
    "priceTextKey": "",
    "filterGroupKey": "boosters",
    "notesKeys": []
  },
  {
    "id": "opt_janssen_radiance_booster_melafadin",
    "serviceId": "svc_janssen_radiance_boost",
    "nameKey": "opt.facial_booster.melafadin",
    "price": { "amount": 5, "currency": "USD" },
    "isOptionPromoActive": false,
    "promoPrice": null,
    "priceTextKey": "",
    "filterGroupKey": "boosters",
    "notesKeys": []
  },
  {
    "id": "opt_janssen_radiance_booster_contour_fluid",
    "serviceId": "svc_janssen_radiance_boost",
    "nameKey": "opt.facial_booster.contour_fluid",
    "price": { "amount": 5, "currency": "USD" },
    "isOptionPromoActive": false,
    "promoPrice": null,
    "priceTextKey": "",
    "filterGroupKey": "boosters",
    "notesKeys": []
  },
  {
    "id": "opt_janssen_radiance_booster_caviar",
    "serviceId": "svc_janssen_radiance_boost",
    "nameKey": "opt.facial_booster.caviar",
    "price": { "amount": 5, "currency": "USD" },
    "isOptionPromoActive": false,
    "promoPrice": null,
    "priceTextKey": "",
    "filterGroupKey": "boosters",
    "notesKeys": []
  },
  {
    "id": "opt_janssen_ultra_booster_melafadin",
    "serviceId": "svc_janssen_ultra_renewal",
    "nameKey": "opt.facial_booster.melafadin",
    "price": { "amount": 5, "currency": "USD" },
    "isOptionPromoActive": false,
    "promoPrice": null,
    "priceTextKey": "",
    "filterGroupKey": "boosters",
    "notesKeys": []
  },
  {
    "id": "opt_janssen_ultra_booster_contour_fluid",
    "serviceId": "svc_janssen_ultra_renewal",
    "nameKey": "opt.facial_booster.contour_fluid",
    "price": { "amount": 5, "currency": "USD" },
    "isOptionPromoActive": false,
    "promoPrice": null,
    "priceTextKey": "",
    "filterGroupKey": "boosters",
    "notesKeys": []
  },
  {
    "id": "opt_janssen_ultra_booster_caviar",
    "serviceId": "svc_janssen_ultra_renewal",
    "nameKey": "opt.facial_booster.caviar",
    "price": { "amount": 5, "currency": "USD" },
    "isOptionPromoActive": false,
    "promoPrice": null,
    "priceTextKey": "",
    "filterGroupKey": "boosters",
    "notesKeys": []
  }
]
