[
  {
    "id": "opt_botox_per_unit",
    "serviceId": "svc_botox",
    "nameKey": "opt.botox.per_unit",
    "price": {
      "amount": 7.75,
      "currency": "USD"
    },
    "isOptionPromoActive": true,
    "promoPrice": {
      "amount": 7.5,
      "currency": "USD"
    },
    "priceTextKey": "",
    "notesKeys": [
      "note.botox.premium_labs",
      "note.botox.any_zone",
      "promo.botox.note2"
    ]
  },
  {
    "id": "opt_botox_45_unit_pack",
    "serviceId": "svc_botox",
    "nameKey": "promo.botox.option_name",
    "optionType": "package",
    "price": {
      "amount": 320,
      "currency": "USD"
    },
    "isOptionPromoActive": true,
    "promoPrice": {
      "amount": 320,
      "currency": "USD"
    },
    "priceTextKey": "",
    "notesKeys": [
      "promo.botox.note1",
      "promo.botox.note2"
    ]
  },
  {
    "id": "opt_dermawrinkle_per_unit",
    "serviceId": "svc_botox",
    "nameKey": "opt.dermawrinkle.per_unit",
    "price": {
      "amount": 5.5,
      "currency": "USD"
    },
    "isOptionPromoActive": true,
    "promoPrice": {
      "amount": 5.25,
      "currency": "USD"
    },
    "priceTextKey": "",
    "notesKeys": [
      "note.dermawrinkle.any_zone",
      "promo.dermawrinkle.note2"
    ]
  },
  {
    "id": "opt_dermawrinkle_45_unit_pack",
    "serviceId": "svc_botox",
    "nameKey": "promo.dermawrinkle.option_name",
    "optionType": "package",
    "price": {
      "amount": 225,
      "currency": "USD"
    },
    "isOptionPromoActive": true,
    "promoPrice": {
      "amount": 225,
      "currency": "USD"
    },
    "priceTextKey": "",
    "notesKeys": [
      "promo.dermawrinkle.note1",
      "promo.dermawrinkle.note2"
    ]
  },
  {
    "id": "opt_weekly_tox_collagen_botox_package",
    "serviceId": "svc_botox",
    "nameKey": "opt.weekly.tox_collagen.botox_package",
    "packageId": "pkg_tox_collagen_allergan",
    "optionType": "package",
    "price": {
      "amount": 1620,
      "currency": "USD"
    },
    "isOptionPromoActive": true,
    "promoPrice": {
      "amount": 1115,
      "currency": "USD"
    },
    "priceTextKey": "",
    "notesKeys": [
      "note.weekly.tox_collagen.includes.heading",
      "note.weekly.tox_collagen.includes.units",
      "note.weekly.tox_collagen.includes.full_face_rf",
      "note.weekly.tox_collagen.includes.hands_rf"
    ]
  },
  {
    "id": "opt_weekly_tox_collagen_generic_package",
    "serviceId": "svc_botox",
    "nameKey": "opt.weekly.tox_collagen.generic_package",
    "packageId": "pkg_tox_collagen_generic",
    "optionType": "package",
    "price": {
      "amount": 1525,
      "currency": "USD"
    },
    "isOptionPromoActive": true,
    "promoPrice": {
      "amount": 1020,
      "currency": "USD"
    },
    "priceTextKey": "",
    "notesKeys": [
      "note.weekly.tox_collagen.includes.heading",
      "note.weekly.tox_collagen.includes.units",
      "note.weekly.tox_collagen.includes.full_face_rf",
      "note.weekly.tox_collagen.includes.hands_rf"
    ]
  }
]
