[
  {
    "id": "opt_sculptra_per_vial",
    "serviceId": "svc_sculptra",
    "nameKey": "opt.sculptra.per_vial",
    "price": {
      "amount": 575,
      "currency": "USD"
    },
    "isOptionPromoActive": true,
    "promoPrice": {
      "amount": 525,
      "currency": "USD"
    },
    "priceTextKey": "",
    "notesKeys": [
      "note.sculptra.vial_price",
      "note.sculptra.vial_quantity"
    ]
  },
  {
    "id": "opt_sculptra_complete_collagen",
    "serviceId": "svc_sculptra",
    "nameKey": "promo.sculptra.option_name",
    "optionType": "package",
    "price": {
      "amount": 1545,
      "currency": "USD"
    },
    "isOptionPromoActive": true,
    "promoPrice": {
      "amount": 1545,
      "currency": "USD"
    },
    "priceTextKey": "",
    "notesKeys": [
      "promo.sculptra.note1",
      "promo.sculptra.note2",
      "promo.sculptra.note3",
      "promo.sculptra.note4"
    ]
  },
  {
    "id": "opt_harmonyca_per_treatment",
    "serviceId": "svc_harmonyca",
    "nameKey": "opt.harmonyca.per_treatment",
    "price": {
      "amount": 15750,
      "currency": "MXN"
    },
    "isOptionPromoActive": false,
    "promoPrice": null,
    "priceTextKey": "",
    "notesKeys": []
  },
  {
    "id": "opt_weekly_ultra_collagen_boost_package",
    "serviceId": "svc_sculptra",
    "nameKey": "opt.weekly.ultra_collagen_boost.package",
    "packageId": "pkg_ultra_collagen_boost_3_session",
    "optionType": "package",
    "price": {
      "amount": 1875,
      "currency": "USD"
    },
    "isOptionPromoActive": true,
    "promoPrice": {
      "amount": 1200,
      "currency": "USD"
    },
    "priceTextKey": "",
    "notesKeys": [
      "note.weekly.ultra_collagen_boost.includes.heading",
      "note.weekly.ultra_collagen_boost.includes.sculptra",
      "note.weekly.ultra_collagen_boost.includes.full_face_rf",
      "note.weekly.ultra_collagen_boost.includes.hands_rf",
      "note.weekly.ultra_collagen_boost.rate.heading",
      "note.weekly.ultra_collagen_boost.rate.intro",
      "note.weekly.ultra_collagen_boost.rate.remaining_sessions",
      "note.weekly.ultra_collagen_boost.rate.updated_pricing",
      "note.weekly.ultra_collagen_boost.rate.bundle_value"
    ]
  }
]
